{
  "synthetic": true,
  "title": "Disclosure notice, explicit saved facts, then a constrained shortlist",
  "notice": "Synthetic and illustrative. Card names, facts and identifiers are invented. Arguments follow the server's input schemas; results show only some of the fields the server returns.",
  "locale": "en-US",
  "market": "US",
  "demonstrates": [
    "The assistant explains what is saved, including request history, before the first Rewardopedia call.",
    "Only explicit statements are saved, as structured entries with a new requestId.",
    "recommend_cards reads saved context itself; it does not save anything.",
    "A clearly named goal is mapped to its goal token, and the assistant says which goal it used.",
    "A card whose fee is unknown does not pass a fee constraint, and a cap without a known amount is described as a cap of unknown size."
  ],
  "steps": [
    {
      "actor": "user",
      "text": "I already have the Example Cash Card. Dining is my priority and I don't want an annual fee over $95."
    },
    {
      "actor": "assistant",
      "text": "Before I use Rewardopedia: it keeps a sanitized history of each Rewardopedia request in your Rewardopedia account until you delete it, and it saves facts you tell me, such as the cards you hold and your goals and constraints, unless you ask me not to. Both are shared across assistants connected to your account, and you can ask what is saved or ask me to forget it at any time. Please don't share card or account numbers. Shall I save that you hold the Example Cash Card, that your goal is dining, and that your annual fee limit is $95?"
    },
    {
      "actor": "user",
      "text": "Yes, save it."
    },
    {
      "actor": "tool_call",
      "tool": "get_my_context",
      "arguments": {}
    },
    {
      "actor": "tool_result",
      "tool": "get_my_context",
      "outcome": "context",
      "result": {
        "contextVersion": 3,
        "asOf": "2026-10-10T15:00:00Z",
        "entries": [],
        "history": []
      }
    },
    {
      "actor": "tool_call",
      "tool": "update_my_context",
      "arguments": {
        "requestId": "00000000-0000-4000-8000-000000000301",
        "expectedVersion": 3,
        "updates": [
          {
            "kind": "wallet",
            "key": "example-cash-card",
            "value": {
              "productName": "Example Cash Card",
              "cardSlug": "example-cash-card"
            }
          },
          {
            "kind": "goal",
            "key": "dining",
            "value": {
              "goal": "dining",
              "priority": 1
            }
          },
          {
            "kind": "constraint",
            "key": "annual-fee-limit",
            "value": {
              "maxAnnualFeeUsd": 95
            }
          }
        ]
      }
    },
    {
      "actor": "tool_result",
      "tool": "update_my_context",
      "outcome": "saved",
      "result": {
        "requestId": "00000000-0000-4000-8000-000000000301",
        "contextVersion": 4,
        "appliedVersion": 4,
        "duplicate": false
      }
    },
    {
      "actor": "tool_call",
      "tool": "recommend_cards",
      "arguments": {
        "contentLocale": "en-US",
        "market": "US",
        "goals": [
          "dining"
        ],
        "constraints": {
          "maxAnnualFeeUsd": 95
        }
      }
    },
    {
      "actor": "tool_result",
      "tool": "recommend_cards",
      "outcome": "recommendations",
      "result": {
        "outcome": "recommendations",
        "methodologyVersion": "card-qualitative-v2",
        "contentLocale": "en-US",
        "market": "US",
        "contextVersion": 4,
        "savedContextUsed": true,
        "contextRefs": [
          "00000000-0000-4000-8000-000000000311"
        ],
        "goals": [
          "dining"
        ],
        "unsupportedGoals": [],
        "unassessedGoals": [],
        "candidates": [
          {
            "rank": 1,
            "cardSlug": "example-dining-card",
            "name": "Example Dining Card",
            "matchedGoals": [
              "dining"
            ],
            "unmatchedGoals": [],
            "facts": {
              "annualFee": {
                "status": "known",
                "amountUsd": 95
              },
              "foreignTransactionFee": {
                "status": "none"
              }
            },
            "reasons": [
              {
                "code": "goal_match",
                "goal": "dining",
                "earningRates": [
                  {
                    "category": "dining",
                    "rate": 3,
                    "rateUnit": "points_per_dollar",
                    "capPeriod": "annually"
                  }
                ]
              }
            ],
            "drawbacks": [
              {
                "code": "annual_fee"
              },
              {
                "code": "earning_rate_capped",
                "category": "dining",
                "capPeriod": "annually"
              }
            ],
            "unknowns": [
              {
                "field": "earning_rate_cap_amount",
                "goal": "dining"
              }
            ],
            "offers": [],
            "followUpQuestions": []
          }
        ],
        "exclusions": [
          {
            "reason": "owned",
            "count": 1
          },
          {
            "reason": "max_annual_fee_unknown",
            "count": 1
          }
        ],
        "followUpQuestions": []
      }
    },
    {
      "actor": "assistant",
      "text": "I used your dining goal and your $95 annual fee limit, and left out the Example Cash Card because you already have it. One card fits: the Example Dining Card. It earns 3 Example Points per $1 on dining, but that rate has an annual cap and Rewardopedia doesn't have the cap amount, so check the issuer's terms before relying on it. Its annual fee is $95 and it has no foreign transaction fee. Example Points are not cash, so their value depends on how you redeem them. One other card was left out because its annual fee is unknown, so it can't be shown to meet your limit."
    }
  ]
}
