{
  "synthetic": true,
  "title": "Inspecting, correcting and deleting saved context",
  "notice": "Synthetic and illustrative. Card names, facts and identifiers are invented. Arguments follow the server's input schemas; results show only some of the fields the server returns.",
  "locale": "es-US",
  "market": "US",
  "demonstrates": [
    "Saved context is inspected before it is described.",
    "A closed card is removed by its entry ID without touching other saved cards.",
    "Every change carries a new requestId and the current contextVersion as expectedVersion.",
    "Deleting everything is confirmed first, and backup limits are not overstated."
  ],
  "steps": [
    {
      "actor": "user",
      "text": "¿Qué recuerdas de mí?"
    },
    {
      "actor": "assistant",
      "text": "Antes de usar Rewardopedia: guarda en tu cuenta de Rewardopedia un historial depurado de cada solicitud, incluidas búsquedas y comparaciones, hasta que lo borres. También guarda los datos que me indicas, como las tarjetas que tienes, pero no guardaré nada que me pidas no guardar. Todo se comparte entre los asistentes conectados a tu cuenta, y puedes pedirme que te muestre o borre lo guardado cuando quieras. No compartas números de tarjeta ni de cuenta."
    },
    {
      "actor": "tool_call",
      "tool": "get_my_context",
      "arguments": {}
    },
    {
      "actor": "tool_result",
      "tool": "get_my_context",
      "outcome": "context",
      "result": {
        "contextVersion": 7,
        "asOf": "2026-10-10T15:00:00Z",
        "entries": [
          {
            "id": "00000000-0000-4000-8000-000000000101",
            "disclosure": {
              "kind": "wallet",
              "key": "example-cash-card",
              "value": {
                "productName": "Example Cash Card",
                "cardSlug": "example-cash-card"
              }
            },
            "active": true
          },
          {
            "id": "00000000-0000-4000-8000-000000000102",
            "disclosure": {
              "kind": "wallet",
              "key": "example-dining-card",
              "value": {
                "productName": "Example Dining Card",
                "cardSlug": "example-dining-card"
              }
            },
            "active": true
          },
          {
            "id": "00000000-0000-4000-8000-000000000103",
            "disclosure": {
              "kind": "goal",
              "key": "groceries",
              "value": {
                "goal": "groceries",
                "priority": 1
              }
            },
            "active": true
          }
        ],
        "history": [],
        "nextBefore": null
      }
    },
    {
      "actor": "assistant",
      "text": "Tengo guardado que tienes la Example Cash Card y la Example Dining Card, y que tu objetivo es comestibles (groceries)."
    },
    {
      "actor": "user",
      "text": "Cerré la Example Dining Card. Y después borra todo."
    },
    {
      "actor": "tool_call",
      "tool": "update_my_context",
      "arguments": {
        "requestId": "00000000-0000-4000-8000-000000000201",
        "expectedVersion": 7,
        "removeIds": [
          "00000000-0000-4000-8000-000000000102"
        ]
      }
    },
    {
      "actor": "tool_result",
      "tool": "update_my_context",
      "outcome": "saved",
      "result": {
        "requestId": "00000000-0000-4000-8000-000000000201",
        "contextVersion": 8,
        "appliedVersion": 8,
        "duplicate": false
      }
    },
    {
      "actor": "assistant",
      "text": "Listo: quité la Example Dining Card y la Example Cash Card sigue guardada. ¿Confirmas que quieres borrar todo lo que Rewardopedia recuerda de ti, incluido el historial? No se puede deshacer."
    },
    {
      "actor": "user",
      "text": "Sí, bórralo todo."
    },
    {
      "actor": "tool_call",
      "tool": "forget_my_context",
      "arguments": {
        "requestId": "00000000-0000-4000-8000-000000000202",
        "expectedVersion": 8,
        "all": true
      }
    },
    {
      "actor": "tool_result",
      "tool": "forget_my_context",
      "outcome": "deleted",
      "result": {
        "requestId": "00000000-0000-4000-8000-000000000202",
        "contextVersion": 9,
        "appliedVersion": 9,
        "duplicate": false
      }
    },
    {
      "actor": "assistant",
      "text": "Borré todo tu contexto guardado y tu historial en Rewardopedia. Las copias de seguridad del servicio no se eliminan de inmediato, y el plazo máximo de conservación aún no se ha publicado; consulta la guía de privacidad."
    }
  ]
}
